{
  "id": "043",
  "bloco": "B1",
  "frente": "B1-F3",
  "slug": "fin-v2-tela-mds-bloco",
  "origem": "humano",
  "objetivo": "(1) Crie src/components/financeiro-v2/mds-util.ts (puro, sem React): lerValorDigitado(texto) aceitando \"7.500,00\", \"7500,00\" e \"7500.00\" (número com 2 casas ou erro); previaRateio(valor, clientes: { nome: string; valor_mensal: number }[]) -> lista { nome, parte } com a mesma regra da função (proporcional à mensalidade, 2 casas, o resto no último pela ordem recebida), só para mostrar na tela; textoSituacao(bloco) -> \"Pago em 05/11: R$ 7.500,00 para 15 clientes\" ou \"Pagamento da MDS ainda não registrado\". Teste em src/components/financeiro-v2/__tests__/mds-util.test.ts (formatos de valor, soma da prévia igual ao valor digitado ao centavo, texto com e sem bloco). (2) Crie src/components/financeiro-v2/mds-cartao.tsx (componente cliente com ds.tsx, format.ts e o util), props { mes: string; resumoMds: { clientes: number; valorMensal: number } | null; aoMudar: () => void }: lê GET /api/financeiro-v2/entradas/mds?mes=<mes>; carregando = Esqueleto; falha = Erro com tentar de novo, nunca \"não registrado\" no lugar de falha. Sem bloco: textoSituacao, a soma das mensalidades MDS do resumo e o botão \"Registrar pagamento da MDS\", que abre diálogo com valor (padrão = valorMensal do resumo), data (padrão hoje, entre o primeiro dia do mês e hoje) e observação; envia POST /api/financeiro-v2/entradas/mds { mes, valor, data, observacao }, trava enquanto grava, mostra o erro da API no diálogo (inclusive a lista de clientes já baixados) e no sucesso fecha e chama aoMudar. Frase no diálogo: \"O valor é dividido entre os clientes da MDS pela mensalidade de cada um.\". Com bloco: textoSituacao, a lista do rateio (cliente e valor) recolhida por padrão e o botão \"Estornar\", que pede motivo obrigatório e avisa \"As baixas dos clientes da MDS deste mês voltam ao estado anterior.\"; envia POST /api/financeiro-v2/entradas/mds/<id>/estorno { motivo } e chama aoMudar. Em 390 px cabe sem rolagem lateral. (3) Em src/components/financeiro-v2/entradas-cliente.tsx: renderize <MdsCartao mes={mes} resumoMds={d?.resumo?.mds ?? null} aoMudar={recarregar} /> logo abaixo do resumo do mês. Nada mais muda no arquivo. FORA DE ESCOPO: rotas e lib (ticket 042), entradas.ts (ticket 031), entradas-acoes.tsx, ds.tsx, interativos.tsx.",
  "pathspec_allowlist": [
    "src/components/financeiro-v2/mds-util.ts",
    "src/components/financeiro-v2/mds-cartao.tsx",
    "src/components/financeiro-v2/__tests__/mds-util.test.ts",
    "src/components/financeiro-v2/entradas-cliente.tsx"
  ],
  "cria_novo": [
    "src/components/financeiro-v2/mds-util.ts",
    "src/components/financeiro-v2/mds-cartao.tsx",
    "src/components/financeiro-v2/__tests__/mds-util.test.ts"
  ],
  "dependencias": [
    "042",
    "031"
  ],
  "diff_estimado": 380,
  "risco": "",
  "criterios_aceite": [
    {
      "tipo": "alvo",
      "descricao": "teste do util da MDS verde",
      "cmd": "node_modules/.bin/vitest run src/components/financeiro-v2/__tests__/mds-util.test.ts >/dev/null 2>&1 && echo OK",
      "espera": "OK"
    },
    {
      "tipo": "guarda",
      "descricao": "o cartão lê a rota da MDS",
      "cmd": "grep -q -F '/api/financeiro-v2/entradas/mds?mes=' \"src/components/financeiro-v2/mds-cartao.tsx\" && echo SIM",
      "espera": "SIM"
    },
    {
      "tipo": "guarda",
      "descricao": "Entradas mostra o cartão da MDS",
      "cmd": "grep -q -F 'MdsCartao' \"src/components/financeiro-v2/entradas-cliente.tsx\" && echo SIM",
      "espera": "SIM"
    },
    {
      "tipo": "guarda",
      "descricao": "testes de componentes do v2 continuam verdes",
      "cmd": "node_modules/.bin/vitest run src/components/financeiro-v2 >/dev/null 2>&1 && echo OK",
      "espera": "OK"
    },
    {
      "tipo": "avaliador",
      "descricao": "avaliador: falha de leitura mostra erro com tentar de novo, nunca 'não registrado'; prévia do rateio só informativa e a gravação é do servidor; estorno exige motivo e avisa o efeito; botões travam durante a gravação; entradas-cliente.tsx só ganhou o cartão; 390 px sem rolagem lateral.",
      "cmd": "true",
      "espera": "avaliador"
    }
  ],
  "status": "pendente",
  "notas_status": "",
  "hash_candidato": "",
  "sinal_hash": "",
  "gate_ok": "",
  "pid": null,
  "iniciado_em": "",
  "adiado_ate": ""
}
